1045,That girl has distinct pink hair,If something is distinct it is easily noticed or different from other things,2,23,distinct,adj,null,Si algo es distinto se nota facilmente o es diferente de otras cosas.
1046,The twins look exactly the same It is hard to distinguish between them,To distinguish is to recognize differences between things,2,23,distinguish,v,null,Distinguir es reconocer las diferencias entre las cosas.
1047,In the old house the dust was thick on the floor and chairs,Dust is very tiny pieces of dirt or other matter,2,23,dust,n,null,El polvo son pedazos muy peque–os de suciedad u otra materia.
1048,Did you see the excitement in her when the team scored?,Excitement means to feel a lot of happiness about something,2,23,excitement,n,null,Emocion significa sentir mucha felicidad por algo.
1049,After my broken arm heals I can play baseball again,To heal means to make a part of the body healthy again after injury,2,23,heal,v,null,Sanar significa hacer que una parte del cuerpo vuelva a estar sana despues de una lesion.
1050,"She inherited her mother""s gold earrings",To inherit is to get something from someone who has died,2,23,inherit,v,null,Heredar es recibir algo de alguien que ha muerto
1051,His manner of not looking at someone while speaking is a bit rude,A manner is the way someone does something,2,23,manner,n,null,Una manera es la forma en que alguien hace algo.
1052,His fear mounted as the monster crawled out from under his bed,Something mounts when it becomes stronger over time,2,23,mount,v,null,Algo se monta cuando se vuelve mas fuerte con el tiempo.
1053,The roof was covered with snow,A roof is the outside top part of a building,2,23,roof,n,null,Un techo es la parte superior exterior de un edificio.
1054,Since there was a shortage of food people were hungry,A shortage is a lack of something you need or want,2,23,shortage,n,null,Una escasez es la falta de algo que necesita o desea.
1055,The safe looked to be quite solid,If something is solid it is made of firm material,2,23,solid,adj,null,Si algo es solido esta hecho de un material firme.
1056,"They keep a stock of rice so they""ll always have something to eat",A stock is a stored amount of something,2,23,stock,n,null,Una accion es una cantidad almacenada de algo
1057,Water is an important substance for all living things,A substance is any specific material or mixture of materials,2,23,substance,n,null,Una sustancia es cualquier material especifico o mezcla de materiales
1058,Their whole family is buried inside the tomb,A tomb is a grave where a dead person is buried,2,23,tomb,n,null,Una tumba es una tumba donde se entierra a una persona muerta.
1059,He had many wounds after the car accident,A wound is an injury to the body,2,23,wound,n,null,Una herida es una herida en el cuerpo.
1060,After playing in the dirt the boy took a bath,A bath is water in a tub People take a bath to get clean,2,24,bath,n,null,Un ba–o es agua en una tina La gente se ba–a para limpiarse
1061,Lee bent over and picked up the paper on the ground,To bend is to move something so it is not straight,2,24,bend,v,null,Doblar es mover algo para que no quede recto
1062,I always chew my food carefully before swallowing it,To chew is to move your mouth to break up food,2,24,chew,v,null,Masticar es mover la boca para desmenuzar los alimentos.
1063,The disabled man used a wheelchair to move around,When a person is disabled they cannot do what a normal person can do,2,24,disabled,adj,null,Cuando una persona esta discapacitada no puede hacer lo que una persona normal puede hacer
1064,The student did a fantastic job on his project and got an award,If something is fantastic it is really good,2,24,fantastic,adj,null,Si algo es fantastico es realmente bueno.
1065,I enjoy reading works of fiction because they are very entertaining,Fiction is a story that is not true,2,24,fiction,n,null,La ficcion es una historia que no es verdad.
1066,Our country has a beautiful flag,A flag is a piece of colored cloth that represents something,2,24,flag,n,null,Una bandera es un trozo de tela de color que representa algo
1067,The mechanic inspected our car to see if it had any problems,To inspect is to look at something carefully,2,24,inspect,v,null,Inspeccionar es mirar algo con atencion.
1068,Mi-young was busy working on an article for an art journal,A journal is a type of magazine that deals with an academic subject,2,24,journal,n,null,Una revista es un tipo de revista que trata sobre un tema academico.
1069,Water is the most important liquid for life,A liquid is a substance that is neither solid nor gas,2,24,liquid,n,null,Un liquido es una sustancia que no es ni solida ni gaseosa.
1070,We marveled at her excellent piano playing,To marvel at something is to feel surprise and interest in it,2,24,marvel,v,null,Maravillarse de algo es sentir sorpresa e interes por ello.
1071,Vegetables are full of important nutrients,A nutrient is something that a living thing needs to keep it alive,2,24,nutrient,n,null,Un nutriente es algo que un ser vivo necesita para mantenerse vivo.
1072,She overcame her shyness and spoke in front of the class,To overcome a problem is to successfully fix it,2,24,overcome,v,null,Superar un problema es solucionarlo con exito
1073,She was trying to recall what she had told her friend,To recall something is to remember it,2,24,recall,v,null,Recordar algo es recordarlo
1074,I regret that I was mean to my sister,"To regret something is to wish that it didn""t happen",2,24,regret,v,null,Lamentar algo es desear que no sucediera
1075,Some people believe that the soul lives after the body dies,"A soul is a person""s spirit",2,24,soul,n,null,Un alma es el espiritu de una persona.
1076,After eating a sufficient amount of food I left the table,When something is sufficient you have enough of it,2,24,sufficient,adj,null,Cuando algo es suficiente tienes suficiente
1077,I needed surgery to repair my leg after the accident,Surgery is medical treatment when the doctor cuts open your body,2,24,surgery,n,null,La cirugia es un tratamiento medico cuando el medico abre su cuerpo
1078,The man passed his driving test even though it was very tough,If something is tough it is difficult,2,24,tough,adj,null,si algo es dificil es dificil
1079,The pile of tubes was going to be put in the ground,A tube is a pipe through which water or air passes,2,24,tube,n,null,Un tubo es un conducto por el que pasa agua o aire
1080,I had to admit that I stole his idea,To admit something means to say that it is true,2,25,admit,v,null,Admitir algo significa decir que es verdad
1081,He put his trash in the bin,A bin is a container that holds things,2,25,bin,n,null,Una papelera es un contenedor que contiene cosas
1082,I ate a bowl of cereal for breakfast,A bowl is a deep round dish that holds food or liquid,2,25,bowl,n,null,Un cuenco es un plato redondo y hondo que contiene comida o liquido.
1083,My grandfather owns a small cabin in the country,A cabin is a small house made of wood,2,25,cabin,n,null,Una caba–a es una peque–a casa hecha de madera.
1084,I was able to save up enough cash to buy my mother a gift,Cash is money in the form of paper or coins,2,25,cash,n,null,El efectivo es dinero en forma de papel o monedas.
1085,"The police made sure the criminal couldn""t move his hands",A criminal is a person who does something against the law,2,25,criminal,n,null,Un delincuente es una persona que hace algo contra la ley.
1086,Mom brought home a dozen donuts for us as a treat,A dozen is a group of twelve things,2,25,dozen,n,null,Una docena es un grupo de doce cosas.
1087,Uncle Ray is my elder so I always try to be respectful,An elder is a person who is older than the people around them,2,25,elder,adj,null,Un anciano es una persona que es mayor que las personas que lo rodean.
1088,I could tell from his facial features that he was angry,"If something is facial it is related to a person""s face",2,25,facial,adj,null,Si algo es facial se relaciona con la cara de una persona.
1089,The farmer put up a fence so that no one could walk on her field,A fence is a structure around a house or field,2,25,fence,n,null,Una valla es una estructura alrededor de una casa o campo.
1090,I was inspired to write a poem after watching the sunrise,To inspire means to make a person want to do something,2,25,inspire,v,null,Inspirar significa hacer que una persona quiera hacer algo.
1091,We lost the game by a mere two points,When something is mere it is small or not important,2,25,mere,adj,null,Cuando algo es mero es peque–o o no importante
1092,My sister always keeps her bedroom very neat,If something is neat it is very clean or organized well,2,25,neat,adj,null,Si algo esta ordenado es que esta muy limpio o bien organizado
1093,Her graduation was an occasion to have a good time,An occasion is a time when something important happens,2,25,occasion,n,null,Una ocasion es un momento en que sucede algo importante.
1094,I had to pay a $100 penalty for parking in the wrong spot,A penalty is a punishment given when someone breaks a rule or law,2,25,penalty,n,null,Una sancion es un castigo dado cuando alguien infringe una regla o ley.
1095,The children at the bus stop were very rude,When someone is rude they are mean and not polite,2,25,rude,adj,null,Cuando alguien es grosero es malo y no educado.
1096,It took three of our best executives all day to settle the problem,To settle a problem means to end it by finding a solution,2,25,settle,v,null,Resolver un problema significa acabar con el encontrando una solucion.
1097,A ferry is a vehicle that takes people from one island to another,A vehicle is a thing that moves people or things to another place,2,25,vehicle,n,null,Un vehiculo es una cosa que mueve personas o cosas a otro lugar.
1098,I keep my money in a wallet,A wallet is a thing that holds money and fits in a pocket,2,25,wallet,n,null,Una billetera es una cosa que contiene dinero y cabe en un bolsillo.
1099,The coach yelled at his team for their poor performance,To yell is to say something very loudly,2,25,yell,v,null,Gritar es decir algo muy alto
1100,She accused her brother of breaking her computer,To accuse someone of something is to blame them for doing it,2,26,accuse,v,null,Acusar a alguien de algo es culparlo por hacerlo
1101,He adjusted the old guitar to make it sound better,To adjust something means to change it so it is better,2,26,adjust,v,null,Ajustar algo significa cambiarlo para que sea mejor
1102,The singer was very good She amused the crowd,To amuse someone means to do something that is funny or entertaining,2,26,amuse,v,null,Divertir a alguien significa hacer algo divertido o entretenido.
1103,The diver admired the beautiful coral under the water,Coral is the hard colorful material formed by the shells of animals,2,26,coral,n,null,El coral es el material duro y colorido formado por las conchas de los animales.
1104,I like to wear clothes made from cotton in the summer,Cotton is a cloth made from the fibers of the cotton plant,2,26,cotton,n,null,El algodon es una tela hecha de las fibras de la planta de algodon.
1105,There was a loud noise when the car crashed into the tree,To crash means to hit and break something,2,26,crash,v,null,Chocar significa golpear y romper algo
1106,A ship will store many supplies below its deck,A deck is a wooden floor built outside of a house or the floor of a ship,2,26,deck,n,null,Una cubierta es un piso de madera construido fuera de una casa o el piso de un barco
1107,Dad was engaged in sawing a piece of wood in half,To engage in something means to do it,2,26,engage,v,null,Participar en algo significa hacerlo
1108,He sleeps better on a firm bed,When something is firm it is solid but not too hard,2,26,firm,adj,null,Cuando algo es firme es solido pero no demasiado duro.
1109,Heat is the fuel that comes from fire,Fuel is something that creates heat or energy,2,26,fuel,n,null,El combustible es algo que genera calor o energia.
1110,The grand mountain rose high into the sky,When something is grand it is big and liked by people,2,26,grand,adj,null,Cuando algo es grandioso es grande y le gusta a la gente.
1111,The wind from the hurricane bent the palm tree,A hurricane is a bad storm that happens over the ocean,2,26,hurricane,n,null,Un huracan es una mala tormenta que ocurre sobre el oceano.
1112,I suffered a big loss while I was gambling,A loss means the act or an instance of losing something,2,26,loss,n,null,Una perdida significa el acto o una instancia de perder algo
1113,He bought a pair of plain white shoes over the weekend,If something is simple it is plain and not decorated,2,26,plain,adj,null,Si algo es simple es sencillo y no decorado.
1114,He walked along the reef and looked at the water below,A reef is a group of rocks or coral that rise to or near the ocean,2,26,reef,n,null,Un arrecife es un grupo de rocas o corales que se elevan hacia o cerca del oceano.
1115,Please shut the door; the air outside is cold,To shut something means to close it tightly,2,26,shut,v,null,Cerrar algo significa cerrarlo hermeticamente
1116,The teacher is strict She does not let students talk in class,When someone is strict they make sure others follow rules,2,26,strict,adj,null,Cuando alguien es estricto se asegura de que los demas sigan las reglas.
1117,The students went to the beach to surf during their vacation,To surf means to use a special board to ride on waves in the ocean,2,26,surf,v,null,Surfear significa usar una tabla especial para cabalgar sobre las olas en el oceano.
1118,My task for the weekend was to clean the entire back yard,A task is a piece of work to be done that is usually difficult,2,26,task,n,null,Una tarea es un trabajo a realizar que suele ser dificil
1119,Firefighters often work in danger zones,A zone is an area that has different qualities from the ones around it,2,26,zone,n,null,Una zona es un area que tiene cualidades diferentes a las que la rodean.
1120,After arguing with her teacher the girl wrote the teacher an apology,An apology is something someone says to show that they are sorry,2,27,apology,n,null,Una disculpa es algo que alguien dice para demostrar que lo siente
1121,The bold man climbed the high mountain,If someone is bold they are not afraid of doing something,2,27,bold,adj,null,Si alguien es audaz no tiene miedo de hacer algo.
1122,James tried to capture the bubbles in his hands,To capture someone or something is to catch them,2,27,capture,v,null,Capturar a alguien o algo es atraparlos
1123,Raising your hand in the classroom before you speak is a cardinal rule,If a rule or quality is cardinal then it is the most important one,2,27,cardinal,adj,null,Si una regla o cualidad es cardinal entonces es la mas importante
1124,The duke ruled over the land,A duke is a man of high social rank but below a king or queen,2,27,duke,n,null,Un duque es un hombre de alto rango social pero por debajo de un rey o una reina.
1125,He took off his shirt exposing his costume,To expose is to make known something that is hidden,2,27,expose,v,null,Exponer es dar a conocer algo que esta oculto.
1126,"I felt guilty for taking my sister""s cookies",If people feel guilty they feel bad for what they did,2,27,guilty,adj,null,Si las personas se sienten culpables se sienten mal por lo que hicieron.
1127,We hired a man to paint our house,To hire someone is to pay them money to work for you,2,27,hire,v,null,Contratar a alguien es pagarle dinero para que trabaje para ti
1128,The judge said that the woman was innocent of the crime,If someone is innocent they are not guilty of a crime,2,27,innocent,adj,null,Si alguien es inocente no es culpable de un crimen
1129,The thief was caught and sent to jail for ten years,Jail is a place where criminals go to be punished,2,27,jail,n,null,La carcel es un lugar donde los delincuentes van a ser castigados.
1130,"The minister of education controls the country""s schools",A minister is an important person in government with many duties,2,27,minister,n,null,Un ministro es una persona importante en el gobierno con muchos deberes.
1131,Today was just an ordinary day Nothing unusual happened,If someone or something is ordinary they are not special in any way,2,27,ordinary,adj,null,Si alguien o algo es ordinario no es especial de ninguna manera.
1132,"We don""t know if Aunt Mildred""s visit will be a permanent one",If something is permanent it lasts for a long time or forever,2,27,permanent,adj,null,Si algo es permanente dura mucho tiempo o para siempre.
1133,Dad sprayed a chemical on the house to help preserve its looks,To preserve is to protect something from harm,2,27,preserve,v,null,Preservar es proteger algo del da–o.
1134,Young children often have trouble pronouncing words right,To pronounce is to say the sounds of letters or words,2,27,pronounce,v,null,Pronunciar es decir los sonidos de letras o palabras
1135,The baby resembles his father a great deal,To resemble someone is to look like them,2,27,resemble,v,null,parecerse a alguien es parecerse a ellos
1136,Sneezing and a high fever are symptoms of the common cold,A symptom of a bad condition or illness is a sign that it is happening,2,27,symptom,n,null,Un sintoma de una mala condicion o enfermedad es una se–al de que esta sucediendo.
1137,The tobacco in cigarettes is bad for your health,Tobacco is a plant whose leaves are smoked such as in cigarettes,2,27,tobacco,n,null,El tabaco es una planta cuyas hojas se fuman como en los cigarrillos.
1138,My sister and I are twins We look exactly the same,Twins are two children born at the same time,2,27,twin,n,null,Los gemelos son dos ni–os nacidos al mismo tiempo.
1139,People think that witches fly around on broomsticks,A witch is a woman with magical powers,2,27,witch,n,null,Una bruja es una mujer con poderes magicos.
1140,My brothers accompanied me to the movie,To accompany other people means to join them or go with them,2,28,accompany,v,null,Acompa–ar a otras personas significa unirse a ellas o ir con ellas.
1141,He likes to walk around in his bare feet,When something is bare it is plain It has no covering,2,28,bare,adj,null,Cuando algo esta desnudo es simple No tiene cubierta
1142,The monkey was hanging from a branch on the tree,A branch is the part of a tree with leaves,2,28,branch,n,null,Una rama es la parte de un arbol con hojas.
1143,"You can""t take a breath under water","A breath is the air that goes into and out of one""s lungs",2,28,breath,n,null,Una respiracion es el aire que entra y sale de los pulmones
1144,The old bridge fell into the river,A bridge is something that is built over a river so people can cross it,2,28,bridge,n,null,Un puente es algo que se construye sobre un rio para que la gente pueda cruzarlo
1145,The fisherman cast his line into the water,To cast something means to throw it,2,28,cast,v,null,Echar algo significa tirarlo
1146,He dared to jump out of the airplane and skydive,To dare means to be brave enough to try something,2,28,dare,v,null,Atreverse significa ser lo suficientemente valiente como para intentar algo.
1147,I like having electronic devices such as an MP3 player,When something is electronic it uses electricity to do something,2,28,electronic,adj,null,Cuando algo es electronico usa electricidad para hacer algo.
1148,The visitor got a room at the inn,An inn is a place where travelers can rest and eat,2,28,inn,n,null,Una posada es un lugar donde los viajeros pueden descansar y comer.
1149,The boy caught butterflies in his net,A net is a bag made of strong thread It is used to catch animals,2,28,net,n,null,Una red es una bolsa hecha de hilo fuerte Se usa para atrapar animales
1150,My philosophy is live and let live ,A philosophy is a way to think about truth and life,2,28,philosophy,n,null,Una filosofia es una forma de pensar sobre la verdad y la vida.
1151,"Don""t touch the pot on the stove It""s hot",A pot is a deep round metal container used for cooking,2,28,pot,n,null,Una olla es un recipiente de metal redondo y profundo que se usa para cocinar.
1152,I planted the seed in the dirt hoping that it would grow into a tree,A seed is the hard part of a plant or fruit that trees grow from,2,28,seed,n,null,Una semilla es la parte dura de una planta o fruto de la que crecen los arboles.
1153,That knife is very sharp Be careful not to hurt yourself,When something is sharp it has a thin edge that cuts things easily,2,28,sharp,adj,null,Cuando algo es afilado tiene un borde delgado que corta las cosas con facilidad.
1154,What sort of instrument do you want to learn to play?,A sort of something is a type of it,2,28,sort,n,null,Una especie de algo es un tipo de ello
1155,We learned how to subtract numbers from each other in class,To subtract means to take something away,2,28,subtract,v,null,Restar significa quitar algo
1156,The knots were too tight to untie,When something is tight it is fixed or fastened firmly in place,2,28,tight,adj,null,Cuando algo esta apretado se fija o sujeta firmemente en su lugar.
1157,"Because he""s popular Joe is the virtual leader of the group",If something is virtual then it is very close to being true or accurate,2,28,virtual,adj,null,Si algo es virtual entonces esta muy cerca de ser verdadero o exacto.
1158,The little dog weighed exactly 3kgs,To weigh something means to see how heavy it is,2,28,weigh,v,null,Pesar algo significa ver cuanto pesa
1159,We have to whisper in the library so people can focus on reading,To whisper means to say very quietly,2,28,whisper,v,null,susurrar significa decir muy bajo
1160,The idea of beauty is abstract and changes over time,If ideas are abstract they are based on general ways of thinking,2,29,abstract,adj,null,Si las ideas son abstractas se basan en formas generales de pensar.
1161,The only time I see my aunts and uncles is at our annual family picnic,If something is annual it happens once a year,2,29,annual,adj,null,Si algo es anual sucede una vez al a–o
1162,She made a bowl out of the clay,Clay is a type of heavy wet soil used to make pots,2,29,clay,n,null,La arcilla es un tipo de tierra humeda pesada que se usa para hacer macetas.
1163,His shirt is made of a very soft type of cloth,Cloth is material used to make clothes,2,29,cloth,n,null,La tela es un material que se usa para hacer ropa.
1164,She opened the curtains to let light into the room,A curtain is a cloth hung over a window or used to divide a room,2,29,curtain,n,null,Una cortina es una tela que se cuelga sobre una ventana o se usa para dividir una habitacion.
1165,The dog deserved a bone for behaving very well,"To deserve is to be worthy of something as a result of one""s actions",2,29,deserve,v,null,Merecer es ser digno de algo como resultado de las acciones de uno.
1166,That bird has orange feathers on its chest,"Feathers are the things covering birds"" bodies",2,29,feather,n,null,Las plumas son las cosas que cubren los cuerpos de las aves.
1167,The farmer grew many vegetables in the fertile soil,If land is fertile it is able to produce good crops and plants,2,29,fertile,adj,null,Si la tierra es fertil es capaz de producir buenas cosechas y plantas
1168,After three days of rain there was a flood in the city,A flood is an event in which water covers an area which is usually dry,2,29,flood,n,null,Una inundacion es un evento en el que el agua cubre un area que generalmente esta seca
1169,His living room only had a few simple pieces of furniture,Furniture is the things used in a house such as tables and chairs,2,29,furniture,n,null,Los muebles son las cosas que se usan en una casa como mesas y sillas.
1170,"We visit our grandfather""s grave each year",A grave is the place where a dead person is buried,2,29,grave,n,null,Una tumba es el lugar donde se entierra a una persona muerta
1171,This house is an ideal place for my family It has everything we need,If something is ideal it is the best that it can possibly be,2,29,ideal,adj,null,Si algo es ideal es lo mejor que puede ser
1172,Because of his high intelligence he finished school early,Intelligence is the ability to learn and understand things,2,29,intelligence,n,null,La inteligencia es la capacidad de aprender y comprender cosas.
1173,In the past people walked everywhere Nowadays they use cars,If something happens nowadays it happens at the present time,2,29,nowadays,adv,null,Si algo sucede hoy en dia sucede en el momento actual.
1174,"After I passed the test I obtained my driver""s license",To obtain is to get something you want or need,2,29,obtain,v,null,Obtener es conseguir algo que se quiere o se necesita
1175,The holy man spoke about religious topics,When something is religious it has to do with religion,2,29,religious,adj,null,Cuando algo es religioso tiene que ver con la religion.
1176,The young couple went to see a romantic movie,When something is romantic it has to do with love,2,29,romantic,adj,null,Cuando algo es romantico tiene que ver con el amor.
1177,There were many pretty shells on the beach,A shell is a hard covering that protects the body of some sea creatures,2,29,shell,n,null,Un caparazon es una cubierta dura que protege el cuerpo de algunas criaturas marinas.
1178,All of the boats were floating near the shore,A shore is the edge of a large body of water,2,29,shore,n,null,Una orilla es el borde de una gran masa de agua.
1179,A car has four wheels,A wheel is a round thing on a vehicle that turns when it moves,2,29,wheel,n,null,Una rueda es una cosa redonda en un vehiculo que gira cuando se mueve.
1180,Sleeping all day appeals to me but I have to go to school,To appeal to someone is to be interesting or attractive to them,2,30,appeal,v,null,Apelar a alguien es ser interesante o atractivo para ellos.
1181,I assume you are both familiar with this plan,To assume something is to think that it is true even with no proof,2,30,assume,v,null,Asumir algo es pensar que es verdad incluso sin pruebas
