0,The woman was afraid of what she saw,When someone is afraid they feel fear,1,1,afraid,adj,null,Cuando alguien tiene miedo siente miedo
1,The food is very good in that restaurant I agree with you,To agree is to say yes or to think the same way,1,1,agree,v,null,Estar de acuerdo es decir que si o pensar de la misma manera
2,She didn't do her homework so her father is angry,When someone is angry they may want to speak loudly or fight,1,1,angry,adj,null,Cuando alguien esta enojado puede querer hablar en voz alta o pelear.
3,The bus always arrives at the corner of my street at 4:00,To arrive is to get to or reach some place,1,1,arrive,v,null,llegar es llegar a o llegar a algun lugar
4,The man with the sword attacked the other man first,To attack is to try to fight or to hurt,1,1,attack,v,null,Atacar es tratar de pelear o herir
5,The bottom of my shoe has a hole in it,The bottom is the lowest part,1,1,bottom,n,null,La parte inferior es la parte mas baja.
6,The clever boy thought of a good idea,When someone is clever they can solve a hard puzzle or problem,1,1,clever,adj,null,Cuando alguien es inteligente puede resolver un rompecabezas o problema dificil.
7,The cruel man yelled at his sister,When someone is cruel they do bad things to hurt others,1,1,cruel,adj,null,Cuando alguien es cruel hace cosas malas para lastimar a los demas.
8,He finally crossed the finish line after five hours of running,If something happens finally it happens after a longtime or at the end,1,1,finally,adv,null,Si algo sucede finalmente sucede despues de mucho tiempo o al final.
9,The other children will hide while you count to 100,To hide is to try not to let others see you,1,1,hide,v,null,Esconderse es intentar que los demas no te vean
10,Long ago people hunted with bows and arrows,To hunt is to look for or search for an animal to kill,1,1,hunt,v,null,Cazar es buscar o buscar un animal para matar
11,There are a lot of apples in the basket,A lot means a large number or amount of people animals things etc,1,1,lot,n,null,Mucho significa un gran numero o cantidad de personas animales cosas etc.
12,The Canadian flag has a maple leaf in the middle of it,The middle of something is the center or halfway point,1,1,middle,n,null,El medio de algo es el centro o punto medio
13,I was only a few moments late for the meeting,A moment is a second or a very short time,1,1,moment,n,null,Un momento es un segundo o un tiempo muy corto.
14,She was pleased with the phone call she received,When someone is pleased they are happy,1,1,pleased,adj,null,Cuando alguien esta contento es feliz
15,He promised to return my key by tomorrow,To promise is to say you will do something for sure,1,1,promise,v,null,Prometer es decir que haras algo seguro
16,She asked him what time his meeting was He replied at three,To reply is to give an answer or say back to someone,1,1,reply,v,null,Responder es dar una respuesta o responder a alguien.
17,Put on your seat belt in the car to be safe,When a person is safe they are not in danger,1,1,safe,adj,null,Cuando una persona esta segura no esta en peligro
18,His card trick really surprised us,A trick is something you do to fool another person,1,1,trick,n,null,Un truco es algo que haces para enga–ar a otra persona
19,The couple can dance quite well,You use well to say that something was done in a good way,1,1,well,adv,null,Se usa bien para decir que algo se hizo de buena manera
20,Riding in the rough water was an adventure,An adventure is a fun or exciting thing that you do,1,2,adventure,n,null,Una aventura es algo divertido o emocionante que haces
21,The boy approached his school,To approach something means to move close to it,1,2,approach,v,null,Acercarse a algo significa moverse cerca de el.
22,The baby carefully climbed down the stairs,Carefully means with great attention especially to detail or safety,1,2,carefully,adv,null,Cuidadosamente significa con gran atencion especialmente a los detalles o la seguridad.
23,The scientist mixed the chemicals,A chemical is something that scientists use in chemistry,1,2,chemical,n,null,Una sustancia quimica es algo que los cientificos usan en quimica.
24,She created an igloo from blocks of snow,To create means to make something new,1,2,create,v,null,Crear significa hacer algo nuevo.
25,The evil figure scared us all,Evil describes something or someone bad or cruel not good,1,2,evil,adj,null,Mal describe algo o alguien malo o cruel no bueno
26,The student did an experiment in science class,An experiment is a test that you do to see what will happen,1,2,experiment,n,null,Un experimento es una prueba que haces para ver que sucede
27,I killed the fly with a fly swatter,To kill someone or something is to make them die,1,2,kill,v,null,Matar a alguien o algo es hacerlo morir
28,My mother works in a laboratory,A laboratory is a room where a scientist works,1,2,laboratory,n,null,Un laboratorio es una habitacion donde trabaja un cientifico.
29,The sound of their laugh filled the room,Laugh is the sound made when someone is happy or a funny thing occurs,1,2,laugh,n,null,La risa es el sonido que se hace cuando alguien esta feliz o cuando ocurre algo gracioso.
30,"The man""s voice was so loud that we all could hear him",If a sound is loud it is strong and very easy to hear,1,2,loud,adj,null,Si un sonido es fuerte es fuerte y muy facil de escuchar.
31,The boy became nervous when he heard the news,When a person is nervous they think something bad will happen,1,2,nervous,adj,null,Cuando una persona esta nerviosa piensa que algo malo va a pasar
32,The crying baby made a loud noise,A noise is an unpleasant sound,1,2,noise,n,null,Un ruido es un sonido desagradable.
33,His afternoon work project was to paint the room green,A project is a type of work that you do for school ora job,1,2,project,n,null,Un proyecto es un tipo de trabajo que haces para la escuela o un trabajo.
34,My uncle was scared by what he saw in the room,To scare someone is to make them feel afraid,1,2,scare,v,null,Asustar a alguien es hacerle sentir miedo
35,The two boys were sharing a secret,A secret is something that you do not tell other people,1,2,secret,n,null,Un secreto es algo que no le cuentas a otras personas
36,My boss shouted at me because I was late for work,To shout is to say something loudly,1,2,shout,v,null,Gritar es decir algo en voz alta
37,The two friends smelled the flower,To smell something means to use your nose to sense it,1,2,smell,v,null,Oler algo significa usar la nariz para sentirlo
38,The way he treated his classmate was terrible,If something is terrible it is very bad,1,2,terrible,adj,null,si algo es terrible es muy malo
39,Business was worse this month than last month,If something is worse it is of poorer quality than another thing,1,2,worse,adj,null,Si algo es peor es de peor calidad que otra cosa
40,The alien came in peace,An alien is a creature from a different world,1,3,alien,n,null,Un extraterrestre es una criatura de un mundo diferente.
41,There was a red apple among the green ones,If you are among certain things they are all around you,1,3,among,prep,null,Si estas entre ciertas cosas estan a tu alrededor.
42,We used a chart to see how we had improved,A chart is a list of information,1,3,chart,n,null,Un grafico es una lista de informacion
43,The sky was filled with white clouds,A cloud is a group of water drops in the sky,1,3,cloud,n,null,Una nube es un grupo de gotas de agua en el cielo.
44,Henry could not comprehend the message,To comprehend something is to understand it,1,3,comprehend,v,null,Comprender algo es comprenderlo.
45,They described their tree as colorful with gold ribbon and a star,To describe is to say or write what someone or something is like,1,3,describe,v,null,Describir es decir o escribir como es alguien o algo.
46,"Going skiing last winter was the most fun I""ve ever had",Ever means at any time,1,3,ever,adv,null,Ever significa en cualquier momento
47,Since he failed to get the job he was sad,To fail means you do not succeed in what you try to do,1,3,fail,v,null,Fracasar significa que no tienes exito en lo que intentas hacer
48,The friendly animals came up to the girl,Friendly is behaving in a pleasant kind way toward someone,1,3,friendly,adj,null,Amigable es comportarse de una manera agradable y amable con alguien.
49,I managed to get good grades on my report card,"A grade is a score or mark given to someone""s work",1,3,grade,n,null,Una calificacion es una puntuacion o nota otorgada al trabajo de alguien.
50,He ate the carrot instead of the ice cream,Instead means in place of,1,3,instead,adv,null,En cambio significa en lugar de
51,The library at school is full of books,A library is a place where you go to read books,1,3,library,n,null,Una biblioteca es un lugar donde vas a leer libros.
52,Saturn is the planet with the ring around it,A planet is a large round thing in space,1,3,planet,n,null,Un planeta es una cosa grande y redonda en el espacio.
53,Karen had trouble writing her report,A report is something students write for school,1,3,report,n,null,Un informe es algo que los estudiantes escriben para la escuela.
54,He had to read several books for class,Several is more than two but not many,1,3,several,adj,null,Varios es mas que dos pero no muchos
55,All the students could easily solve the math problem,To solve something is to find an answer to it,1,3,solve,v,null,Resolver algo es encontrarle una respuesta.
56,I was suddenly surprised by the cake my friends brought me,If something happens suddenly it happens quickly and unexpectedly,1,3,suddenly,adv,null,Si algo sucede de repente sucede de forma rapida e inesperada.
57,I suppose I should go home now,To suppose is to guess,1,3,suppose,v,null,Suponer es adivinar
58,The universe is so large that it cannot be measured,The universe is the known or supposed objects in space,1,3,universe,n,null,El universo son los objetos conocidos o supuestos en el espacio.
59,Michael likes to view himself in the mirror,To view is to look at something,1,3,view,v,null,Ver es mirar algo.
60,"It""s appropriate to wear a suit when you go to the office",When a thing is appropriate it is right or normal,1,4,appropriate,adj,null,Cuando algo es apropiado es correcto o normal
61,Avoid the broken bottle on the floor,To avoid something is to stay away from it,1,4,avoid,v,null,Evitar algo es alejarse de ello.
62,She always behaves well when her father is around,To behave is to act in a particular way especially to be good,1,4,behave,v,null,Comportarse es actuar de una manera particular especialmente para ser bueno
63,A nice warm bath makes me feel so calm,When someone is calm they do not get excited or upset,1,4,calm,adj,null,Cuando alguien esta tranquilo no se emociona ni se enfada
64,I was filled with concern after reading the newspaper,Concern is a feeling of worry,1,4,concern,n,null,La preocupacion es un sentimiento de preocupacion.
65,The baby looked very content sitting on the floor,To be content is to be happy and not want more,1,4,content,adj,null,Estar contento es ser feliz y no querer mas
66,I expect the bus to be here very soon,If you expect something to happen you believe it will happen,1,4,expect,v,null,Si esperas que algo suceda crees que sucedera
67,We meet frequently either at the beginning or ending of the week,When something happens frequently it happens often,1,4,frequently,adv,null,Cuando algo sucede con frecuencia sucede con frecuencia.
68,Smoking is a bad habit that can kill you,A habit is a thing that you do often,1,4,habit,n,null,Un habito es algo que haces a menudo.
69,My teacher instructs us in several subjects,To instruct is to teach,1,4,instruct,v,null,Instruir es ense–ar
70,The men spoke about issues that were important to the people,An issue is an important topic,1,4,issue,n,null,Un asunto es un tema importante
71,He spent all his money There is none left,None means not any of someone or something,1,4,none,pron,null,Ninguno significa no cualquiera de alguien o algo.
72,"I had to be patient and wait until 5 o""clock to leave","If a person is patient they don""t become angry or upset easily",1,4,patient,adj,null,Si una persona es paciente no se enfada ni se molesta facilmente.
73,She has a positive future ahead of her after finishing college,If something is positive it is good,1,4,positive,adj,null,si algo es positivo es bueno
74,To punish me my teacher had me stand in the corner,To punish means to make someone suffer for breaking the rules or laws,1,4,punish,v,null,Castigar significa hacer sufrir a alguien por infringir las normas o leyes.
75,My lawyer will represent me in court,To represent is to speak or act for a person or group,1,4,represent,v,null,Representar es hablar o actuar por una persona o grupo
76,When people shake hands it usually means they agree,To shake is to move back and forth or up and down quickly,1,4,shake,v,null,Sacudir es moverse hacia adelante y hacia atras o hacia arriba y hacia abajo rapidamente
77,I like to spread butter on my toast,To spread is to move quickly to more places,1,4,spread,v,null,Difundir es moverse rapidamente a mas lugares
78,My dog and I strolled through the park today,To stroll means to walk slowly and calmly,1,4,stroll,v,null,Pasear significa caminar despacio y con calma.
79,There are only a few houses in my village,A village is a very small town,1,4,village,n,null,Un pueblo es un pueblo muy peque–o.
80,I was not aware of the ringing phone,If you are aware of something you know about it,1,5,aware,adj,null,Si eres consciente de algo que sabes al respecto.
81,He hurt his arm badly playing with friends,Badly means in a severe or harmful way,1,5,badly,adv,null,Mal significa de una manera severa o da–ina.
82,The blue suit belongs to Paul,If something belongs to you you own it,1,5,belong,v,null,Si algo te pertenece lo posees
83,She stood under her umbrella as the rain continued to fall,To continue something is to keep doing it,1,5,continue,v,null,Continuar algo es seguir haciendolo
84,I made an error on my report so my boss was angry,An error is something you do wrong,1,5,error,n,null,Un error es algo que haces mal
85,Rock climbing was a fun experience,An experience is something you have seen or done,1,5,experience,n,null,Una experiencia es algo que has visto o hecho.
86,The field of flowers looked so pretty,A field is a big area of land,1,5,field,n,null,Un campo es una gran area de tierra.
87,She hurt her leg falling down the stairs,To hurt is to do something that makes you feel pain,1,5,hurt,v,null,Herir es hacer algo que te hace sentir dolor
88,"It""s good judgment to recycle your aluminum cans",Judgment is the ability to form opinions or decisions,1,5,judgment,n,null,El juicio es la capacidad de formar opiniones o decisiones.
89,I will likely stay at home and watch TV tonight,If something likely happens it will probably happen,1,5,likely,adv,null,Si algo probable sucede probablemente sucedera
90,It is normal for me to bathe every night,If something is normal it is not strange nor surprising to you,1,5,normal,adj,null,Si algo es normal no te resulta extra–o ni sorprendente
91,It is rare for him to miss his flight,If something is rare you do not see it very often,1,5,rare,adj,null,Si algo es raro no lo ves muy seguido
92,The frog relaxed in the warm sun,To relax is to rest,1,5,relax,v,null,Relajarse es descansar
93,The little girl requested a special gift from Santa Claus,To request something is to ask for it,1,5,request,v,null,Pedir algo es pedirlo
94,My brother and his family reside in a lovely house on the beach,To reside means to live somewhere permanently or for a long time,1,5,reside,v,null,Residir significa vivir en algun lugar de forma permanente o durante mucho tiempo.
95,Asa result of all the rain the man had to climb on the roof,A result is something that happens because of something else,1,5,result,n,null,Un resultado es algo que sucede debido a otra cosa.
96,You must roll the ball into the pins when you bowl,To roll is to move by turning over and over,1,5,roll,v,null,Rodar es moverse dando vueltas y vueltas
97,Since 1992 he has been driving that car,Since is used to talk about a past event still happening now,1,5,since,prep,null,Dado que se usa para hablar de un evento pasado que todavia esta sucediendo ahora
98,The moon and stars were visible in the night sky,If something is visible it can be seen,1,5,visible,adj,null,Si algo es visible se puede ver
99,You should be careful around a fox because it is a wild animal,If something is wild it is found in nature,1,5,wild,adj,null,Si algo es salvaje se encuentra en la naturaleza
100,Being tall is an advantage to a basketball player,An advantage is something that helps you,1,6,advantage,n,null,Una ventaja es algo que te ayuda
101,The cold weather caused her to get sick,To cause is to make something happen,1,6,cause,v,null,Causar es hacer que algo suceda.
102,I had my choice of five doors to open,A choice is the act or possibility of picking something,1,6,choice,n,null,Una eleccion es el acto o la posibilidad de escoger algo
103,The kids from my community usually play together,A community is a group of people who live together,1,6,community,n,null,Una comunidad es un grupo de personas que viven juntas
104,A dead person is usually buried in the ground,To be dead is to not be alive,1,6,dead,adj,null,Estar muerto es no estar vivo
105,The distance between the Earth and the Moon is 384400 kilometers,The distance between two things is how far it is between them,1,6,distance,n,null,La distancia entre dos cosas es la distancia que hay entre ellas
106,The butterfly could not escape from the cage,To escape is to run away from something bad,1,6,escape,v,null,Escapar es huir de algo malo
107,My sister and I have to find a better way to face our differences,If you face a problem you deal with it,1,6,face,v,null,Si te enfrentas a un problema lo resuelves
108,The little boy followed his mother home,To follow means to go behind someone and go where they go,1,6,follow,v,null,Seguir significa ir detras de alguien e ir a donde vaya.
109,She was filled with fright,Fright is the feeling of being scared,1,6,fright,n,null,El susto es la sensacion de tener miedo.
110,Many people are afraid of ghosts,A ghost is the spirit of a dead person,1,6,ghost,n,null,Un fantasma es el espiritu de una persona muerta.
111,Only one individual could win the bicycle race,An individual is one person,1,6,individual,n,null,Un individuo es una persona
112,Out of all my pets the dog is my favorite,A pet is an animal that lives with people,1,6,pet,n,null,Una mascota es un animal que vive con personas.
113,I was happy to finally reach my destination,To reach means to arrive at a place,1,6,reach,v,null,Alcanzar significa llegar a un lugar
114,I was happy to return home to my mom after school,To return is to go back to a place,1,6,return,v,null,Volver es volver a un lugar
115,My dog survived her fall into the water,To survive is to stay alive,1,6,survive,v,null,Sobrevivir es mantenerse vivo
116,She was upset because she broke her toy,To be upset is to be unhappy about something,1,6,upset,adj,null,Estar molesto es estar infeliz por algo.
117,He used a microphone so everyone could hear his voice,A voice is the sound a person makes when they talk or sing,1,6,voice,n,null,Una voz es el sonido que hace una persona cuando habla o canta
118,The weather can be sunny rainy or cold,The weather is the condition of the air: hot rainy windy etc,1,6,weather,n,null,El clima es la condicion del aire: caliente lluvioso ventoso etc.
119,Many people believe that owls are very wise animals,To be wise is to use experience and intelligence to make good choices,1,6,wise,adj,null,Ser sabio es usar la experiencia y la inteligencia para tomar buenas decisiones
120,Having a ticket will allow you to enter the show,To allow something to happen means to let it happen,1,7,allow,v,null,Permitir que algo suceda significa dejar que suceda
121,He announced to everyone his new idea for the company,To announce something is to make it known,1,7,announce,v,null,Anunciar algo es darlo a conocer
122,The two brothers stood beside each other,When someone or something is beside you they are next to you,1,7,beside,prep,null,Cuando alguien o algo esta a tu lado esta a tu lado.
123,It was a challenge to climb to the top of the mountain,A challenge is something difficult to complete,1,7,challenge,n,null,Un desafio es algo dificil de completar.
124,"He claimed to know why the country""s laws were weak",To claim means to say that something is true,1,7,claim,v,null,Afirmar significa decir que algo es verdad
125,"The patient""s condition was very good",The condition of someone or something is the state that they are in,1,7,condition,n,null,La condicion de alguien o algo es el estado en que se encuentra
126,We decided to contribute money to the new hospital,To contribute to something means to do something to make it successful,1,7,contribute,v,null,Contribuir a algo significa hacer algo para que tenga exito.
127,The biggest difference between the birds is the color of their feathers,A difference is a way that something is not like other things,1,7,difference,n,null,Una diferencia es una forma en que algo no es como otras cosas.
128,We divided the pizza,To divide something is to make it into smaller parts,1,7,divide,v,null,Dividir algo es dividirlo en partes mas peque–as.
129,The wizard was an expert at magic,An expert is someone who is very good at doing something,1,7,expert,n,null,Un experto es alguien que es muy bueno haciendo algo
130,The Eiffel Tower in Paris is very famous,If someone or something is famous they are known to many people,1,7,famous,adj,null,Si alguien o algo es famoso muchas personas lo conocen.
131,He used all his force to try and open the door,"Force is a person""s strength or power",1,7,force,n,null,La fuerza es la fuerza o el poder de una persona.
132,A hot iron can cause great harm if you are not careful,Harm is hurt or problems caused to someone or something,1,7,harm,n,null,El da–o es da–o o problemas causados ____a alguien o algo.
133,"Don""t lay your socks on the floor",To lay means to put or place in a horizontal or flat position,1,7,lay,v,null,Poner significa poner o colocar en una posicion horizontal o plana
134,A white dove is a symbol for peace,Peace is a time without war,1,7,peace,n,null,La paz es un tiempo sin guerra
135,The prince and the princess were married,A prince is the son of a king,1,7,prince,n,null,Un principe es el hijo de un rey.
136,Firemen protect us from fires,To protect someone is to stop them from getting hurt,1,7,protect,v,null,Proteger a alguien es evitar que se lastime
137,I could sense that he was watching me,To sense something is to know about it without being told,1,7,sense,v,null,Sentir algo es saber sobre ello sin que te lo digan
138,He felt a sudden pain in his chest,When something is sudden it happens very quickly,1,7,sudden,adj,null,Cuando algo es repentino sucede muy rapido
139,He is fat Therefore he will go on a diet,Therefore means for this reason,1,7,therefore,adv,null,Por lo tanto significa por esta razon
140,"I accepted the girl""s very nice gift",To accept something that is offered is to take it,1,8,accept,v,null,Aceptar algo que se ofrece es tomarlo
141,Please arrange the bowling pins in order so we can play,To arrange things is to put them in the right place,1,8,arrange,v,null,Ordenar las cosas es ponerlas en el lugar correcto
142,My sister and I attend the same school,To attend something is to go to it,1,8,attend,v,null,Asistir a algo es ir a ello.
143,We saw an elephant balance itself on a ball,To balance something is to keep it from falling,1,8,balance,v,null,Equilibrar algo es evitar que se caiga
144,The contrast between my parents is very noticeable,A contrast is the sharp difference between two things,1,8,contrast,ncontrast,null,Un contraste es la marcada diferencia entre dos cosas.
145,My football coach will encourage us when we are losing,To encourage someone is to make them want to do something,1,8,encourage,v,null,Animar a alguien es hacer que quiera hacer algo.
146,The two friends were very familiar with each other,If someone or something is familiar to you you know them well,1,8,familiar,adj,null,Si alguien o algo te es familiar lo conoces bien
147,I grabbed a pear from the tree,To grab is to take a hold of someone or something suddenly,1,8,grab,v,null,Agarrar es agarrar a alguien o algo de repente
148,I drew a picture of my family and my mother hung it on the wall,To hang something is to keep it above the ground,1,8,hang,v,null,Colgar algo es mantenerlo sobre el suelo
149,At work my father drives a huge truck,If something is huge it is very big,1,8,huge,adj,null,Si algo es grande es muy grande
150,It is necessary to have a passport when you travel to a foreign country,If something is necessary you must do it,1,8,necessary,adj,null,Si algo es necesario debes hacerlo
151,"My pattern of brushing my teeth is the same as most people""s",A pattern is a way in which something is done or organized,1,8,pattern,n,null,Un patron es una forma en que se hace u organiza algo.
152,Santa Claus proposed that I try to be a good boy all year,To propose something is to say that it should be done,1,8,propose,v,null,Proponer algo es decir que se debe hacer
153,The purpose of exercising is to get into shape,A purpose is the reason that you do something,1,8,purpose,n,null,Un proposito es la razon por la que haces algo.
154,She released the bird from her hands,To release something is to stop holding it,1,8,release,v,null,Liberar algo es dejar de retenerlo.
155,We require teachers to have a university degree,To require something is to say that it is necessary,1,8,require,v,null,Requerir algo es decir que es necesario
156,I have a single key in my hand,If something is single then there is only one,1,8,single,adj,null,Si algo es unico entonces solo hay uno
