2002,The robber was armed with a gun,If you are armed you are carrying a weapon,4,11,armed,adj,null,Si estas armado llevas un arma.
2003,"This book is an authoritative source on Ancient Egypt""s Queen Nefertiti",If something is authoritative it uses the best information available,4,11,authoritative,adj,null,Si algo tiene autoridad utiliza la mejor informacion disponible.
2004,"Tom and Amy""s marriage ceremony is in June",A ceremony is an event that happens on special occasions,4,11,ceremony,n,null,Una ceremonia es un evento que ocurre en ocasiones especiales.
2005,Ancient Mexican culture is renowned for its architecture,Culture is the music art and writings of a certain place or group of people,4,11,culture,n,null,La cultura es el arte de la musica y los escritos de un determinado lugar o grupo de personas.
2006,The airforce works in defense of its country,A defense is something that is done to protect another thing,4,11,defense,n,null,Una defensa es algo que se hace para proteger otra cosa
2007,Jane told Ben all the details of her trip to China,A detail is a small piece of information,4,11,detail,n,null,Un detalle es una peque–a pieza de informacion.
2008,Big cities have diverse populations with people of different races and ages,When a group of things is diverse it is made up of a wide variety of things,4,11,diverse,adj,null,Cuando un grupo de cosas es diverso se compone de una gran variedad de cosas
2009,The beautiful woman enchanted everybody in the room,To enchant someone is to make them feel very interested or happy,4,11,enchant,v,null,Encantar a alguien es hacerlo sentir muy interesado o feliz
2010,Steve was equipped with the tools needed to do the job,To equip someone is to give them the things needed to do something,4,11,equip,v,null,Equipar a alguien es darle las cosas necesarias para hacer algo.
2011,Most students thought the test was hard but Tim was the exception,An exception is someone or something not conforming to a rule,4,11,exception,n,null,Una excepcion es alguien o algo que no se ajusta a una regla
2012,She is considered a master in the comedy genre,A genre is a type of literature art or music characterized by its style,4,11,genre,n,null,Un genero es un tipo de literatura arte o musica que se caracteriza por su estilo.
2013,My grandmother had a great impact on my life,An impact is the effect someone or something has on another,4,11,impact,n,null,Un impacto es el efecto que alguien o algo tiene sobre otro
2014,The store lures people in with big signs that say 'Sale!',To lure someone is to convince them to do something by using a trick,4,11,lure,v,null,Atraer a alguien es convencerlo de que haga algo usando un truco
2015,Climbing over the giant rock was the biggest obstacle for the hikers,An obstacle is an object or a problem that stops you from doing something,4,11,obstacle,n,null,Un obstaculo es un objeto o un problema que le impide hacer algo
2016,The frog took shelter from the storm in a nearby cave,A shelter is a place to go that is safe from danger or bad weather,4,11,shelter,n,null,Un refugio es un lugar para ir que esta a salvo del peligro o del mal tiempo.
2017,He sorted his clothes by colors and sizes,To sort means to separate things into different groups or classes,4,11,sort,v,null,Ordenar significa separar las cosas en diferentes grupos o clases.
2018,The water heater supplied the house with warm water,To supply something means to give people what they need or want,4,11,supply,v,null,Suministrar algo significa dar a la gente lo que necesita o quiere.
2019,Rebecca is so vain that she looks at herself in every mirror,If people are vain they are only concerned with how they look,4,11,vain,adj,null,Si las personas son vanidosas solo les preocupa como se ven
2020,Her first plan to make extra money seemed weak so she chose an alternative,An alternative is something that you can choose instead of your first choice,4,12,alternative,n,null,Una alternativa es algo que puede elegir en lugar de su primera opcion
2021,Drive down this avenue and then turn left to go to the park,An avenue is a road often a large one with buildings on each side,4,12,avenue,n,null,Una avenida es una carretera a menudo grande con edificios a cada lado.
2022,His belly was full because he ate a lot of food,The belly is the stomach of a person or animal,4,12,belly,n,null,El vientre es el estomago de una persona o animal.
2023,"He made a bid to become the university""s next president",A bid to do something is an attempt to do it,4,12,bid,n,null,Una oferta para hacer algo es un intento de hacerlo
2024,The wind is blowing very hard today We should stay inside,To blow means to move air or move something through the air as in the wind,4,12,blow,v,null,Soplar significa mover el aire o mover algo a traves del aire como en el viento.
2025,The two nations had a conflict over which one could use the water in the river,A conflict is a fight between different people or groups,4,12,conflict,n,null,Un conflicto es una pelea entre diferentes personas o grupos.
2026,Asia is the largest continent,A continent is one of the seven large areas of land on the Earth,4,12,continent,n,null,Un continente es una de las siete grandes extensiones de tierra en la Tierra
2027,The ocean currents took the ship far off into the sea,A current is a steady and constant flow of air or water in a river or ocean,4,12,current,n,null,Una corriente es un flujo constante y constante de aire o agua en un rio u oceano.
2028,He showed disrespect by arguing with his boss during a meeting,Disrespect is rudeness or a behavior that shows a lack of respect,4,12,disrespect,n,null,La falta de respeto es la mala educacion o un comportamiento que muestra una falta de respeto.
2029,The crowd showed their enthusiasm for the soccer team by cheering loudly,Enthusiasm is a very strong good feeling about something,4,12,enthusiasm,n,null,El entusiasmo es un buen sentimiento muy fuerte acerca de algo.
2030,The desert can be a very harsh environment,When something is harsh it is very unpleasant,4,12,harsh,adj,null,Cuando algo es duro es muy desagradable.
2031,The woman leaned against the counter because she was tired,To lean is to bend the body in a particular direction,4,12,lean,v,null,Inclinarse es doblar el cuerpo en una direccion particular.
2032,Ted began setting the table In the meantime I began preparing the food,The meantime is the time between two events,4,12,meantime,n,null,El entretanto es el tiempo entre dos eventos.
2033,Ben was up to mischief when he persuaded Ken to paint his face,Mischief is behavior that is meant to trick or cause trouble for people,4,12,mischief,n,null,La travesura es un comportamiento destinado a enga–ar o causar problemas a las personas.
2034,She went to the gym in order to make her muscles stronger,Muscle is a mass of tissue attached to bone that helps you move,4,12,muscle,n,null,El musculo es una masa de tejido unido al hueso que le ayuda a moverse
2035,The firefighter rescued the man from the burning building,To rescue someone means to remove them from danger,4,12,rescue,v,null,Rescatar a alguien significa sacarlo del peligro.
2036,The student said the letters of the alphabet in succession,A succession is a number of things that follow one after the other,4,12,succession,n,null,Una sucesion es un numero de cosas que van una tras otra
2037,The terrain below was rocky and full of hills,The terrain is the land and all of its physical features or parts,4,12,terrain,n,null,El terreno es la tierra y todas sus caracteristicas fisicas o partes
2038,The timid child hides behind her mother whenever she sees a stranger,If someone is timid they are afraid shy or nervous,4,12,timid,adj,null,Si alguien es timido tiene miedo es timido o esta nervioso.
2039,The boy hit his brother in an act of violence,Violence is forceful action that is meant to injure or kill people,4,12,violence,n,null,La violencia es una accion forzosa que tiene por objeto herir o matar a las personas
2040,"The student""s poor attitude affected the other students in the class",To affect someone or something is to have an influence over them,4,13,affect,v,null,Afectar a alguien o algo es tener una influencia sobre ellos.
2041,"Everybody wanted the movie star""s autograph",An autograph is the written name of a famous person,4,13,autograph,n,null,Un autografo es el nombre escrito de una persona famosa.
2042,Beads of water collected outside the glass,A bead is a drop of liquid,4,13,bead,n,null,Una perla es una gota de liquido.
2043,Please brew a fresh pot of coffee,To brew coffee or tea means to pour hot water over it,4,13,brew,v,null,Preparar cafe o te significa verter agua caliente sobre el.
2044,Gail charmed everyone with her humorous stories,To charm someone is to please them with your personality,4,13,charm,v,null,Encantar a alguien es complacerlo con tu personalidad
2045,It was his destiny to become a great singer,A destiny is all the things that happen or will happen to a person in their life,4,13,destiny,n,null,Un destino son todas las cosas que le suceden o le sucederan a una persona en su vida
2046,The boy honked his horn while he rode his bicycle past the house,A horn is a device that makes a loud noise,4,13,horn,n,null,Una bocina es un dispositivo que hace un ruido fuerte
2047,"She is irritable when she doesn""t get enough sleep",When someone is irritable they become annoyed or angry very easily,4,13,irritable,adj,null,Cuando alguien esta irritable se enfada o enfada con mucha facilidad.
2048,The girl on rollerblades lagged behind the little girl on the bicycle,To lag behind is to move slowly behind other moving objects,4,13,lag,v,null,Rezagarse es moverse lentamente detras de otros objetos en movimiento.
2049,Businesses try to maximize their profits,To maximize something means to make it the biggest in size or amount,4,13,maximize,v,null,Maximizar algo significa hacerlo el mas grande en tama–o o cantidad
2050,The girl was scared to go back to sleep because she had a nightmare,A nightmare is a bad or scary dream,4,13,nightmare,n,null,Una pesadilla es un sue–o malo o aterrador.
2051,Mangoes are one of the most nutritious fruits in the world,When something is nutritious it helps the body stay healthy,4,13,nutritious,adj,null,Cuando algo es nutritivo ayuda al cuerpo a mantenerse saludable
2052,Fish and beef are good sources of protein,Protein is a substance that is necessary for the body to grow and be strong,4,13,protein,n,null,La proteina es una sustancia necesaria para que el cuerpo crezca y sea fuerte.
2053,I put my signature at the end of the letter,A signature is your name that you have written in your own way,4,13,signature,n,null,Una firma es tu nombre que has escrito a tu manera
2054,We gave a lot of stuff to the charity,Stuff is a word used to refer to things without mentioning the things by name,4,13,stuff,n,null,Cosas es una palabra que se usa para referirse a cosas sin mencionar las cosas por su nombre.
2055,Breathing is one of the subconscious things that the body does,When something is subconscious it is done without thinking about it,4,13,subconscious,adj,null,Cuando algo es subconsciente se hace sin pensarlo
2056,The delivery company uses large vans to deliver packages,A van is a vehicle that is used for carrying things but is smaller than a truck,4,13,van,n,null,Una furgoneta es un vehiculo que se utiliza para transportar cosas pero es mas peque–o que un camion.
2057,The lifeguard warned people to stay away from the rough ocean,To warn someone is to make them know of possible danger in the future,4,13,warn,v,null,Advertir a alguien es hacerle saber de un posible peligro en el futuro
2058,"She doesn""t do her workout on the weekends",A workout is an exercise routine that helps improve health,4,13,workout,n,null,Un entrenamiento es una rutina de ejercicios que ayuda a mejorar la salud
2059,The cars zoomed along the road,To zoom is to move quickly,4,13,zoom,v,null,Hacer zoom es moverse rapidamente
2060,There were several bricks scattered on the ground,A brick is a block of hard clay that is used for building things such as walls,4,14,brick,n,null,Un ladrillo es un bloque de arcilla dura que se usa para construir cosas como paredes.
2061,"The old house""s walls crumbled into a pile of rock and wood",To crumble means to break or fall apart into small pieces,4,14,crumble,v,null,Desmenuzar significa romper o desmoronarse en pedazos peque–os
2062,I made heart-shaped cookies from the dough,Dough is a mixture of flour and water that becomes bread when baked,4,14,dough,n,null,La masa es una mezcla de harina y agua.
2063,The nurse expressed her sympathy for the sick patient,To express a feeling or idea means to show others how one thinks or feels,4,14,express,v,null,Expresar un sentimiento o una idea significa mostrar a los demas como se piensa o se siente
2064,The bully made a fist and threatened to hit the small boy,A fist is a hand with fingers bent in toward the palm,4,14,fist,n,null,Un pu–o es una mano con los dedos doblados hacia la palma.
2065,The tree branch was so flexible it could be bent into a circle and not break,If something is flexible then it can bend easily without breaking,4,14,flexible,adj,null,Si algo es flexible puede doblarse facilmente sin romperse.
2066,"After the long race the runner""s face was flushed",To flush means the face becomes red due to heat illness or emotion,4,14,flush,v,null,Enrojecerse significa que la cara se enrojece debido a una enfermedad por calor o una emocion.
2067,The car crash injured two people,To injure someone means to damage a part of their body,4,14,injure,v,null,Herir a alguien significa da–ar una parte de su cuerpo.
2068,The artist took a lump of clay and turned it into a beautiful pot,A lump is a small piece of something that is solid,4,14,lump,n,null,Un bulto es una peque–a pieza de algo que es solido.
2069,The walls were built using a mixture of water rock and dirt,A mixture is something that is made by mixing other things together,4,14,mixture,n,null,Una mezcla es algo que se hace mezclando otras cosas
2070,After arguing the two friends were reconciled with each other,To reconcile means to return to a friendly relationship,4,14,reconcile,v,null,Reconciliarse significa volver a una relacion amistosa
2071,Our walk in the park was ruined by the sudden rain,To ruin something means to harm or damage it greatly,4,14,ruin,v,null,Arruinar algo significa da–arlo o da–arlo en gran medida.
2072,When the ball hit the window the glass shattered,To shatter something means to break it suddenly into many tiny pieces,4,14,shatter,v,null,Romper algo significa romperlo repentinamente en muchos pedazos peque–os.
2073,Mr Smith closed the shutters every night to make his bedroom dark,Shutters are wooden or metal covers in front of a window,4,14,shutter,n,null,Las persianas son cubiertas de madera o metal frente a una ventana.
2074,The baker sifted the flour into a large bowl,To sift something means to remove all the large pieces,4,14,sift,v,null,Tamizar algo significa quitar todas las piezas grandes
2075,"There was only a slight change in the little boy""s height",If something is slight then it is small or minor,4,14,slight,adj,null,Si algo es leve entonces es peque–o o menor.
2076,"The stars sparkled in the winter night""s sky",To sparkle means to shine brightly with quick flashes of light,4,14,sparkle,v,null,Brillar significa brillar intensamente con rapidos destellos de luz.
2077,He sprinkled the pasta with salt and black pepper,To sprinkle means to scatter something all over something else,4,14,sprinkle,v,null,Rociar significa esparcir algo sobre otra cosa
2078,The cookies sat on the table so long that they became stale,If food is stale then it is not fresh but dry hard and not good to eat,4,14,stale,adj,null,Si la comida esta rancia entonces no es fresca sino que esta seca y no es buena para comer.
2079,The lost boy was so scared that he could barely utter a single word,To utter a word or a sound means to say it,4,14,utter,v,null,Pronunciar una palabra o un sonido significa decirlo
2080,Although she was late her friends gave her a warm welcome,You use although to say that one thing is contrasted by another,4,15,although,conj,null,Aunque se usa para decir que una cosa contrasta con otra
2081,She always applies makeup to her face before going outside,To apply something means to put it on,4,15,apply,v,null,Aplicar algo significa ponerlo
2082,"The players awaited the judge""s decision",To await something means to wait for it,4,15,await,v,null,Esperar algo significa esperarlo
2083,The boy took a nap next to his beloved cat,When something is beloved it is very special and you like it very much,4,15,beloved,adj,null,Cuando algo es amado es muy especial y te gusta mucho
2084,They buried their grandfather under his favorite tree after he died,To bury someone or something means to put them in the ground,4,15,bury,v,null,Enterrar a alguien o algo significa ponerlos bajo tierra
2085,The climate in the desert is very hot,A climate is the usual weather in a place,4,15,climate,n,null,Un clima es el tiempo habitual en un lugar
2086,The workers complained that they were being treated unfairly,When you complain you say that you are unhappy about something,4,15,complain,v,null,Cuando te quejas dices que no estas contento con algo
2087,The sign confused the traveler because it pointed in two directions,To confuse someone means to make them feel like they are unsure,4,15,confuse,v,null,Confundir a alguien significa hacerle sentir que no esta seguro
2088,The papers were due on the 19th,When something is due it is expected to happen or be done at that time,4,15,due,adj,null,Cuando se debe algo se espera que suceda o se haga en ese momento.
2089,He was so hungry that he ate the entire pizza by himself,When you talk about an entire thing you are talking about the whole thing,4,15,entire,adj,null,Cuando hablas de todo estas hablando de todo
2090,He wanted to establish a club for people to help the Earth,To establish something means to create it,4,15,establish,v,null,Establecer algo significa crearlo.
2091,Mr Jones came to fix the furnace,A furnace is a place where heat is made,4,15,furnace,n,null,Un horno es un lugar donde se produce calor.
2092,A lot of dogs must wear a leash to keep them from running away,A leash is a rope or chain that is used to lead an animal,4,15,leash,n,null,Una correa es una cuerda o cadena que se utiliza para llevar a un animal
2093,When they matured they became as tall as their parents,To mature means to grow up to become an adult,4,15,mature,v,null,Madurar significa crecer para convertirse en un adulto
2094,The scientists carefully measured the amount of chemicals in the tubes,To measure something means to find out the quality value or effect of it,4,15,measure,v,null,Medir algo significa averiguar el valor cualitativo o el efecto de ello.
2095,She was in the midst of cleaning when the telephone rang,The midst of something is the middle of it,4,15,midst,n,null,El medio de algo es el medio de eso
2096,There was a lot of misery after Sam lost his dog,Misery is extreme suffering,4,15,misery,n,null,La miseria es un sufrimiento extremo.
2097,Ron had to wait since he arrived prior to the scheduled meeting time,When something happened prior to something else it happened earlier,4,15,prior,adj,null,Cuando algo sucedio antes de que otra cosa sucediera antes
2098,Scientists did a lot of research on the subject of blood type,Research is close and careful study to discover new things,4,15,research,n,null,La investigacion es un estudio cercano y cuidadoso para descubrir cosas nuevas.
2099,There are a variety of flowers at the shop,A variety of something is a group of many different kinds of it,4,15,variety,n,null,Una variedad de algo es un grupo de muchos tipos diferentes de algo.
2100,The company stopped using sugar altogether in its food,If something happens altogether it happens completely,4,16,altogether,adv,null,Si algo sucede por completo sucede completamente.
2101,The victims of the flood were bound by their need to help each other,To bind is to bring people together,4,16,bind,v,null,Atar es unir a las personas
2102,She got a bruise on her knee from falling down,A bruise is a dark mark caused by being hit by something,4,16,bruise,n,null,Un moreton es una marca oscura causada por ser golpeado por algo
2103,It is a custom that the bride and groom have the first dance,A custom is a way of doing things that has been the same for a long time,4,16,custom,n,null,Una costumbre es una forma de hacer las cosas que ha sido la misma durante mucho tiempo.
2104,"The disobedient children didn""t listen to their mother and had an accident",When someone is disobedient they do not follow the rules or instructions,4,16,disobedient,adj,null,Cuando alguien es desobediente no sigue las reglas o instrucciones.
2105,"The teacher didn""t foresee any problems with her large class",To foresee something is to know about it before it happens,4,16,foresee,v,null,Prever algo es saberlo antes de que suceda
2106,She glimpsed outside the window as the plane was about to land,To glimpse something is to see it for a short time,4,16,glimpse,v,null,Vislumbrar algo es verlo por poco tiempo
2107,The boys tried to toss the ball through the basketball hoop,A hoop is a ring that is made of plastic metal or wood,4,16,hoop,n,null,Un aro es un anillo que esta hecho de plastico metal o madera.
2108,His family helped him when he encountered misfortune,Misfortune is bad luck or an unlucky event,4,16,misfortune,n,null,La desgracia es mala suerte o un evento desafortunado.
2109,"She doesn""t like to say negative things about her friends",When something is negative it is unpleasant or sad,4,16,negative,adj,null,Cuando algo es negativo es desagradable o triste
2110,It costs $8 per person to watch the baseball game,Per is used to mean 'each' when giving a price size or amount,4,16,per,prep,null,Per se usa para significar 'each' cuando se da un tama–o o cantidad de precio
2111,He pleaded for his parents to let him go to the soccer game,To plead is to ask for something you want very badly,4,16,plead,v,null,Suplicar es pedir algo que deseas mucho.
2112,She ripped the paper in half by accident,To rip something means to pull it apart,4,16,rip,v,null,Rasgar algo significa separarlo
2113,"The parents worked hard for their children""s sake",The sake of something is the reason for doing it,4,16,sake,n,null,El bien de algo es la razon para hacerlo
2114,I accidentally scraped the paint off the side of the car,To scrape something is to rub it very hard with something sharp,4,16,scrape,v,null,Raspar algo es frotarlo muy fuerte con algo afilado
2115,The river was the source of drinking water for the village,A source of something is the place that it comes from,4,16,source,n,null,Una fuente de algo es el lugar de donde viene
2116,"The stern teacher didn""t allow the students to speak during class",When somebody is stern they are very serious,4,16,stern,adj,null,Cuando alguien es severo es muy serio
2117,My grandmother stitched the pieces together to make a big blanket,To stitch is to use a needle and thread to join pieces of cloth together,4,16,stitch,v,null,Coser es usar una aguja e hilo para unir piezas de tela
2118,They heard the thump when the bowling ball hit the floor,A thump is the sound of a heavy object falling,4,16,thump,n,null,Un golpe es el sonido de un objeto pesado cayendo
2119,Gina was vehement when she found out that Liz was bad in school,When somebody is vehement they are angry and emotional,4,16,vehement,adj,null,Cuando alguien es vehemente esta enojado y emocional.
2120,"Most early civilizations in Central America didn""t use metal weapons",A civilization is an organized group of humans that have culture and government,4,17,civilization,n,null,Una civilizacion es un grupo organizado de humanos que tienen cultura y gobierno.
2121,The bus is a convenient way to get to school,When something is convenient it is easy to do and does not take a lot of work,4,17,convenient,adj,null,Cuando algo es conveniente es facil de hacer y no requiere mucho trabajo.
2122,The mother lion left her babies in the den,A den is a living space for some types of animals such as lions,4,17,den,n,null,Una guarida es un espacio habitable para algunos tipos de animales como los leones.
2123,When we woke up we saw that the grass was covered in dew,Dew is the drops of water that form on the ground outside during the night,4,17,dew,n,null,El rocio son las gotas de agua que se forman en el suelo afuera durante la noche.
2124,She made a drastic decision to get her long hair cut short,When something is drastic it is extreme or major,4,17,drastic,adj,null,Cuando algo es drastico es extremo o importante
2125,The students exited through the front door,To exit means to leave,4,17,exit,v,null,Salir significa salir
2126,There was one black sheep in the entire flock,A flock is a group of animals such as birds sheep or goats,4,17,flock,n,null,Un reba–o es un grupo de animales como aves ovejas o cabras.
2127,I folded the paper and put it in my pocket,To fold is to bend something like paper or cloth so that it takes up less space,4,17,fold,v,null,Doblar es doblar algo como papel o tela para que ocupe menos espacio
2128,He lifted the lid of the box and revealed her present,A lid is a top for a box or container that can be removed,4,17,lid,n,null,Una tapa es una tapa para una caja o contenedor que se puede quitar
2129,The ominous clouds loomed over the school,To loom is to seem very large and often scary,4,17,loom,v,null,Telar es parecer muy grande y a menudo aterrador.
2130,The mighty wrestler scared all who faced him,When something is mighty it is strong and large,4,17,mighty,adj,null,Cuando algo es poderoso es fuerte y grande
